formulaRank,molecularFormula,adduct,precursorFormula,NPC#pathway,NPC#pathway Probability,NPC#superclass,NPC#superclass Probability,NPC#class,NPC#class Probability,ClassyFire#superclass,ClassyFire#superclass probability,ClassyFire#class,ClassyFire#class Probability,ClassyFire#subclass,ClassyFire#subclass Probability,ClassyFire#level 5,ClassyFire#level 5 Probability,ClassyFire#most specific class,ClassyFire#most specific class Probability,ClassyFire#all classifications,ionMass,retentionTimeInSeconds,retentionTimeInMinutes,formulaId,alignedFeatureId,mappingFeatureId,overallFeatureQuality
1,C3H9MgNO5,[M - H2O + H]+,C3H8MgNO4+,Carbohydrates,0.956,Aminosugars and aminoglycosides,0.812,Aminosugars,0.886,Organic oxygen compounds,0.999,Organooxygen compounds,0.988,Carbohydrates and carbohydrate conjugates,0.574,Sugar alcohols,0.54,Sugar alcohols,0.54,"Organic compounds; Carbohydrates and carbohydrate conjugates; Alcohols and polyols; Organonitrogen compounds; Primary alcohols; Organooxygen compounds; Secondary alcohols; 1,2-aminoalcohols; Sugar alcohols; Polyols; Amines; Alkanolamines; Hydrocarbon derivatives; Organopnictogen compounds; Organic oxygen compounds; Organic nitrogen compounds; Chemical entities",146.029,24,0.401,7.38708E+17,7.38708E+17,1,
1,Ca3Cl2FHMgNO2S,[M + K]+,Ca3Cl2FHKMgNO2S+,Alkaloids,0.103,Oligopeptides,0.025,Halogenated fatty acids,0.027,Organic acids and derivatives,0.883,Organic sulfonic acids and derivatives,0.795,Organosulfonic acids and derivatives,0.79,,,Organosulfonic acids and derivatives,0.79,Organic compounds; Organosulfur compounds; Organic acids and derivatives; Organohalogen compounds; Organosulfonic acids and derivatives; Organoarsenic compounds; Organometallic compounds; Sulfonyls; Organometalloid compounds; Organochlorides; Organofluorides; Alkyl halides; Organic salts; Organic oxides; Organic metalloid salts; Organic metal salts; Hydrocarbon derivatives; Sulfur-containing organoarsenic compounds; Oxygen-containing organoarsenic compounds; Organic sulfonic acids and derivatives; Organopnictogen compounds; Organic oxygen compounds; Organic nitrogen compounds; Chemical entities,350.743,29,0.484,7.38708E+17,7.38708E+17,2,
1,C46H59N3O8,[M + H]+,C46H60N3O8+,Polyketides,0.976,Oligopeptides,0.995,Depsipeptides,0.994,Organic acids and derivatives,1,Peptidomimetics,0.941,Depsipeptides,0.919,Cyclic depsipeptides,0.89,Cyclic depsipeptides,0.89,"Organic compounds; Organoheterocyclic compounds; Amino acids, peptides, and analogues; Lactones; Alpha amino acids and derivatives; Macrolactams; Macrolides and analogues; Lactams; Phenylpropanoids and polyketides; Organic acids and derivatives; Carboxylic acids and derivatives; Organonitrogen compounds; Organooxygen compounds; Amino acids and derivatives; Alpha amino acid esters; Carboxylic acid amides; Carboxylic acid derivatives; Carboxylic acid esters; Tertiary carboxylic acid amides; Peptidomimetics; Carbonyl compounds; Macrolide lactams; Depsipeptides; Tricarboxylic acids and derivatives; Cyclic depsipeptides; Organic oxides; Azacyclic compounds; Oxacyclic compounds; Hydrocarbon derivatives; Valine and derivatives; Organopnictogen compounds; Organic oxygen compounds; Organic nitrogen compounds; Chemical entities",782.441,29,0.484,7.38708E+17,7.38708E+17,3,
1,C2H2BrCl3O4S3,[M + K]+,C2H2BrCl3KO4S3+,Fatty acids,0.711,Fatty acyls,0.148,Halogenated fatty acids,0.099,Organic acids and derivatives,0.975,Organic sulfonic acids and derivatives,0.926,Organosulfonic acids and derivatives,0.926,,,Organosulfonic acids and derivatives,0.926,Organic compounds; Organosulfur compounds; Organic acids and derivatives; Organohalogen compounds; Organosulfonic acids and derivatives; Sulfonyl halides; Alkyl chlorides; Sulfonyls; Organochlorides; Alkyl halides; Organic oxides; Hydrocarbon derivatives; Organic sulfonic acids and derivatives; Organic oxygen compounds; Chemical entities,408.701,29,0.488,7.38708E+17,7.38708E+17,4,
1,C3H2BrCl5O2S2,[M + Na]+,C3H2BrCl5NaO2S2+,Fatty acids,0.854,Fatty acyls,0.228,Halogenated fatty acids,0.597,Organosulfur compounds,0.834,Sulfenyl compounds,0.552,,,,,Sulfenyl compounds,0.552,Organic compounds; Organosulfur compounds; Organohalogen compounds; Alkyl chlorides; Organochlorides; Alkyl halides; Sulfenyl compounds; Hydrocarbon derivatives; Organic oxygen compounds; Chemical entities,410.698,29,0.488,7.38708E+17,7.38708E+17,5,
